{
  "$schema": "http://json-schema.org/draft-07/schema#",
  "$id": "https://philby-glm/spec/task.schema.json",
  "title": "Philby task-state object",
  "description": "Core domain object carried by the agent across long-lived objectives. The agent emits domain events into `evidence[]` and advances `plan[].state` and `status` as work proceeds.",
  "type": "object",
  "required": ["goal", "given", "when", "then", "status", "plan", "evidence"],
  "additionalProperties": false,
  "properties": {
    "goal": {
      "type": "string",
      "minLength": 1,
      "description": "User-defined objective, stated as a single sentence."
    },
    "given": {
      "type": "array",
      "description": "Preconditions and inputs the task assumes.",
      "items": { "type": "string" }
    },
    "when": {
      "type": "array",
      "description": "Permissions granted to the agent for this task.",
      "items": { "type": "string" }
    },
    "then": {
      "type": "array",
      "description": "Success criteria, typically Make targets that must pass.",
      "items": { "type": "string" }
    },
    "status": {
      "type": "string",
      "enum": ["active", "blocked", "done", "abandoned"],
      "description": "Lifecycle state of the whole task."
    },
    "plan": {
      "type": "array",
      "description": "Ordered steps. Each has an independent state.",
      "items": {
        "type": "object",
        "required": ["step", "state"],
        "additionalProperties": false,
        "properties": {
          "step": { "type": "string", "minLength": 1 },
          "state": {
            "type": "string",
            "enum": ["pending", "active", "done", "blocked"]
          }
        }
      }
    },
    "evidence": {
      "type": "array",
      "description": "Append-only log of domain events emitted by the agent.",
      "items": {
        "type": "object",
        "required": ["command", "exit", "summary"],
        "additionalProperties": false,
        "properties": {
          "command": { "type": "string", "minLength": 1 },
          "exit": { "type": "integer" },
          "summary": { "type": "string", "minLength": 1 },
          "at": {
            "type": "string",
            "description": "ISO-8601 timestamp of the event."
          }
        }
      }
    }
  }
}
